Accession number,Title,Organism,Sequence length,CG %
CALNHV010000002.1,"Bacteroides uniformis strain BUAKA3JSW genome assembly, contig: BUAKA3JSW_2, whole genome shotgun sequence",Bacteroides uniformis,450885,0.07246376811594203
LT962477.2,"Komagataella phaffii CBS 7435 genome assembly, chromosome: Komagataella_phaffii_CBS_7435__2",Komagataella phaffii CBS 7435,2396459,0.014492753623188406
NM_002616.3,"Homo sapiens period circadian regulator 1 (PER1), mRNA",Homo sapiens,4676,0.043478260869565216
NM_001405510.1,"Triticum aestivum 1-Cys peroxiredoxin PER1-like (LOC543108), mRNA",Triticum aestivum,1377,0.057971014492753624
NM_001159367.2,"Mus musculus period circadian clock 1 (Per1), transcript variant 2, mRNA",Mus musculus,4665,0.014492753623188406
